{
  "schema_version": 1,
  "suite": "offline-replay",
  "suite_notes": "Offline replay fixtures for the twelve in_chat_path_gate analytics-gate questions (#1682). Each fixture drives the real Spring AI ChatClient/ToolCallingAdvisor loop (OfflineReplayEvaluator, reusing SpringAiPosAssistant.buildToolCallingChatClient) against a live model, with tool execution replaced by the fixture's canned tool_responses so no backend service or database is touched. system_prompt is a representative synthetic prompt, not a byte-identical capture of a live-assembled prompt; prompt-assembly fidelity is out of scope here (see analytics-gate/README.md non-goals). tool_responses use clean, designed-only synthetic data (the EXPECTED.md 'absolute'/'seed contribution' figures), not alpha's live co-tenant-polluted numbers, so a fixture's expected values are self-consistent regardless of alpha's current data. argument key checks (arguments_contains) assert presence only, not value equality, since not every @Tool method's exact parameter surface is re-verified here (facade-contract.yaml plus each controller's real @RequestParam names were checked once for real values (startDate/endDate/asOfDate/period/etc.), and unverifiable/uncertain surfaces are left unchecked rather than guessed). Run: ./mvnw -pl pos-mcp-server -Dmcp.eval.replay=true -Dit.test=OfflineReplayEvalIT verify",
  "fixtures": [
    {
      "fixture_id": "q01",
      "analytics_gate_fixture_id": "q01",
      "utterance": "Who were our top technicians by labor revenue last month, and what was their average billed hours per completed work order?",
      "system_prompt": "You are the Durion Positivity shop assistant. Answer using only tool results; never fabricate figures. Call the analytics tools you are offered to compute the answer, then summarize.",
      "offered_tools": [
        {
          "name": "getTechnicianLaborAnalytics",
          "description": "Returns per-technician completed work order count, billed hours and labor revenue for a date range.",
          "input_schema": "{\"type\":\"object\",\"properties\":{\"startDate\":{\"type\":\"string\"},\"endDate\":{\"type\":\"string\"}},\"required\":[\"startDate\",\"endDate\"]}"
        },
        {
          "name": "getRevenueByCustomer",
          "description": "Returns per-customer revenue for a period (decoy: not a per-technician report).",
          "input_schema": "{\"type\":\"object\",\"properties\":{\"period\":{\"type\":\"string\"}},\"required\":[\"period\"]}"
        }
      ],
      "tool_responses": [
        {
          "tool_name": "getTechnicianLaborAnalytics",
          "arguments_contains": ["startDate", "endDate"],
          "response": "{\"rows\":[{\"technician\":\"Nadia Torres\",\"completedWorkorders\":2,\"billedHours\":4.00,\"laborRevenue\":1500.00,\"avgHoursPerWorkorder\":2.00},{\"technician\":\"Alex Kim\",\"completedWorkorders\":3,\"billedHours\":5.00,\"laborRevenue\":950.00,\"avgHoursPerWorkorder\":1.67},{\"technician\":\"Sam Ellison\",\"completedWorkorders\":1,\"billedHours\":4.00,\"laborRevenue\":600.00,\"avgHoursPerWorkorder\":4.00}]}"
        }
      ],
      "expected": {
        "outcome": "answered-correctly",
        "tool_call_sequence": ["getTechnicianLaborAnalytics"],
        "numbers": [{"label": "top technician labor revenue", "value": 1500.00, "tolerance_pct": 0.5}],
        "id_set": ["Nadia Torres"],
        "forbidden_labels": ["Alex Kim"]
      },
      "notes": "Top by labor revenue is Nadia Torres (1500.00); Alex Kim has more completed work orders but less revenue and must not be named as top."
    },
    {
      "fixture_id": "q03",
      "analytics_gate_fixture_id": "q03",
      "utterance": "Which technicians had the most work orders reopened within seven days of completion this quarter?",
      "system_prompt": "You are the Durion Positivity shop assistant. Answer using only tool results; never fabricate figures. Call the analytics tools you are offered to compute the answer, then summarize.",
      "offered_tools": [
        {
          "name": "workorder_getReopenedWorkorderAnalytics",
          "description": "Returns per-technician reopened-work-order counts within a reopen window for a date range.",
          "input_schema": "{\"type\":\"object\",\"properties\":{\"startDate\":{\"type\":\"string\"},\"endDate\":{\"type\":\"string\"},\"withinDays\":{\"type\":\"integer\"},\"limit\":{\"type\":\"integer\"}},\"required\":[\"startDate\",\"endDate\"]}"
        }
      ],
      "tool_responses": [
        {
          "tool_name": "workorder_getReopenedWorkorderAnalytics",
          "arguments_contains": ["startDate", "endDate"],
          "response": "{\"rows\":[{\"technician\":\"Sam Ellison\",\"reopenedCount\":2},{\"technician\":\"Alex Kim\",\"reopenedCount\":1},{\"technician\":\"Nadia Torres\",\"reopenedCount\":0}]}"
        }
      ],
      "expected": {
        "outcome": "answered-correctly",
        "tool_call_sequence": ["workorder_getReopenedWorkorderAnalytics"],
        "numbers": [{"label": "Sam Ellison reopen count", "value": 2, "tolerance_pct": 0}],
        "id_set": ["Sam Ellison"]
      }
    },
    {
      "fixture_id": "q04",
      "analytics_gate_fixture_id": "q04",
      "utterance": "What was the average time from work order creation to invoice, by month, for the last six months?",
      "system_prompt": "You are the Durion Positivity shop assistant. Answer using only tool results; never fabricate figures. This question needs one getInvoicingLag call per month in the window; do not summarize a partial set of months as if it were the full answer.",
      "offered_tools": [
        {
          "name": "getInvoicingLag",
          "description": "Returns the average work-order-creation-to-invoice lag in days for one date range.",
          "input_schema": "{\"type\":\"object\",\"properties\":{\"startDate\":{\"type\":\"string\"},\"endDate\":{\"type\":\"string\"}},\"required\":[\"startDate\",\"endDate\"]}"
        }
      ],
      "tool_responses": [
        {"tool_name": "getInvoicingLag", "arguments_contains": ["startDate", "endDate"], "response": "{\"month\":\"2026-03\",\"avgLagDays\":2.00,\"pairCount\":6}"},
        {"tool_name": "getInvoicingLag", "arguments_contains": ["startDate", "endDate"], "response": "{\"month\":\"2026-04\",\"avgLagDays\":3.00,\"pairCount\":7}"},
        {"tool_name": "getInvoicingLag", "arguments_contains": ["startDate", "endDate"], "response": "{\"month\":\"2026-05\",\"avgLagDays\":4.00,\"pairCount\":7}"},
        {"tool_name": "getInvoicingLag", "arguments_contains": ["startDate", "endDate"], "response": "{\"month\":\"2026-06\",\"avgLagDays\":5.00,\"pairCount\":5}"},
        {"tool_name": "getInvoicingLag", "arguments_contains": ["startDate", "endDate"], "response": "{\"month\":\"2026-07\",\"avgLagDays\":6.00,\"pairCount\":5}"},
        {"tool_name": "getInvoicingLag", "arguments_contains": ["startDate", "endDate"], "response": "{\"month\":\"2026-08\",\"avgLagDays\":7.00,\"pairCount\":5}"}
      ],
      "expected": {
        "outcome": "answered-correctly",
        "tool_call_sequence": ["getInvoicingLag", "getInvoicingLag", "getInvoicingLag", "getInvoicingLag", "getInvoicingLag", "getInvoicingLag"],
        "numbers": [{"label": "August average lag", "value": 7.00, "tolerance_pct": 0.5}]
      },
      "notes": "Pins the #1676 declined-composition failure mode: a below-minimum call count (fewer than 6 getInvoicingLag calls) is the defect this fixture is built to catch, matching QUESTIONS.json q04.expected_plan."
    },
    {
      "fixture_id": "q05",
      "analytics_gate_fixture_id": "q05",
      "utterance": "Which customers are more than 60 days past due, and what open work orders do we currently have for them?",
      "system_prompt": "You are the Durion Positivity shop assistant. Answer using only tool results; never fabricate figures. This question needs one aged-receivables call, then one searchWorkorders call per past-due customer; do not stop after the first call.",
      "offered_tools": [
        {
          "name": "getAgedReceivables",
          "description": "Returns per-customer A/R aging buckets as of a date.",
          "input_schema": "{\"type\":\"object\",\"properties\":{\"asOfDate\":{\"type\":\"string\"}},\"required\":[\"asOfDate\"]}"
        },
        {
          "name": "searchWorkorders",
          "description": "Searches work orders by a query string (e.g. customer id and status).",
          "input_schema": "{\"type\":\"object\",\"properties\":{\"query\":{\"type\":\"string\"}},\"required\":[\"query\"]}"
        }
      ],
      "tool_responses": [
        {
          "tool_name": "getAgedReceivables",
          "arguments_contains": ["asOfDate"],
          "response": "{\"rows\":[{\"customerId\":\"C1\",\"total\":4500.00,\"bucket9099\":2000.00,\"pastDue\":true},{\"customerId\":\"C2\",\"total\":2000.00,\"bucket6190\":1500.00,\"pastDue\":true},{\"customerId\":\"C3\",\"total\":1200.00,\"pastDue\":false}]}"
        },
        {
          "tool_name": "searchWorkorders",
          "arguments_contains": ["query"],
          "response": "{\"rows\":[{\"workorderId\":\"TRACKB-WO-OPEN-C1-ASSIGNED\",\"customerId\":\"C1\",\"status\":\"ASSIGNED\"},{\"workorderId\":\"TRACKB-WO-OPEN-C1-WIP\",\"customerId\":\"C1\",\"status\":\"WORK_IN_PROGRESS\"}]}"
        },
        {
          "tool_name": "searchWorkorders",
          "arguments_contains": ["query"],
          "response": "{\"rows\":[{\"workorderId\":\"TRACKB-WO-OPEN-C2-PARTS\",\"customerId\":\"C2\",\"status\":\"AWAITING_PARTS\"}]}"
        }
      ],
      "expected": {
        "outcome": "answered-correctly",
        "tool_call_sequence": ["getAgedReceivables", "searchWorkorders", "searchWorkorders"],
        "id_set": ["TRACKB-WO-OPEN-C1-ASSIGNED", "TRACKB-WO-OPEN-C1-WIP", "TRACKB-WO-OPEN-C2-PARTS"],
        "forbidden_labels": ["TRACKB-WO-OPEN-C3-APPROVED"]
      },